{"version": "3.0", "resumen": {"total_respuestas": 0, "total_con_comentario": 0, "total_analizados": 0, "comentarios_invalidos": 0, "distribucion_sentimiento": {"positivo": 0, "neutro": 0, "negativo": 0}, "distribucion_intensidad": {"alta": 0, "media": 0, "baja": 0}, "pasivos": 0, "detractores": 0, "nota": "Se analizan y clasifican semánticamente todos los comentarios libres ingresados en la encuesta."}, "insights_ia": {"global": "El análisis cualitativo revela que el tema más relevante en este período es 'Calidad docente' con un total de 0 menciones. La distribución general muestra 0 comentarios positivos y 0 comentarios negativos.", "por_categoria_padre": {"Académico": "No se registraron comentarios significativos sobre aspectos académicos en este período.", "Administrativo y Bienestar": "No se reportan incidencias ni comentarios sobre procesos administrativos en este período.", "Infraestructura": "La infraestructura física y tecnológica no registra menciones en las respuestas libres de este período.", "Valoración General": "No se registran comentarios de valoración institucional general en este período."}}, "topicos": [], "comentarios": [], "por_carrera": [], "por_ciclo": []}